{
 "authority": {
  "can_decide": false,
  "note": "This packet frames required adversarial reviews; script generation never answers or decides them."
 },
 "bracket": {
  "source": "grok_estimated_ceiling",
  "suite_family": "B4_resilience",
  "value": 4
 },
 "canonical_hash": "lh1:8209700d366bf1d170808cde40d673074040d4ca96e115f928f0a6ceb423c5b1",
 "deck_id": "Wick__the_Whorled_Mind",
 "evidence_class": "strategic_judgment",
 "limitations": [
  "Evidence context is assembled mechanically and may include irrelevant rows; the reviewer must judge relevance.",
  "A pending red-team prompt is not a judgment_review and cannot support an M6 decision.",
  "No script-authored verdict or recommendation is permitted.",
  "Priority weights allocate review attention only.",
  "Later judgment must preserve Commander-first identity and bracket-specific context."
 ],
 "packet_context": {
  "audit_slots": 98,
  "commander_role": "central",
  "failure_modes": 3
 },
 "reviews": [
  {
   "adversarial_challenge": "Assume multiple permanent types are answered over several turns. Identify which strategic routes actually rebuild and which collapse after repeated removal.",
   "analysis": null,
   "can_decide": false,
   "evidence_context": {
    "audit_focus": [
     {
      "blueprint_refs": [
       "blueprint:data/grixis/blueprints/wick-the-whorled-mind.json#packages/pkg:outlets",
       "blueprint:data/grixis/blueprints/wick-the-whorled-mind.json#win_conditions/snail-rat-loop"
      ],
      "card": "Altar of Dementia",
      "decision_support": true,
      "disposition": "strong_retain",
      "graph_refs": [
       "graph:data/grixis/graph/wick-the-whorled-mind.json#metrics/Altar of Dementia",
       "graph:data/grixis/graph/wick-the-whorled-mind.json#combo:5256-5853-5929",
       "graph:data/grixis/graph/wick-the-whorled-mind.json#combo:803-5256-5853"
      ],
      "roles": [],
      "structural_necessity": "important"
     },
     {
      "blueprint_refs": [
       "blueprint:data/grixis/blueprints/wick-the-whorled-mind.json#requirements/value"
      ],
      "card": "An Offer You Can't Refuse",
      "decision_support": true,
      "disposition": "functional_retain",
      "graph_refs": [
       "graph:data/grixis/graph/wick-the-whorled-mind.json#metrics/An Offer You Can't Refuse"
      ],
      "roles": [
       "counter",
       "ramp"
      ],
      "structural_necessity": "redundant"
     },
     {
      "blueprint_refs": [
       "blueprint:data/grixis/blueprints/wick-the-whorled-mind.json#engines/type-change",
       "blueprint:data/grixis/blueprints/wick-the-whorled-mind.json#identity_core/Arcane Adaptation",
       "blueprint:data/grixis/blueprints/wick-the-whorled-mind.json#key_interactions/add-not-replace"
      ],
      "card": "Arcane Adaptation",
      "decision_support": true,
      "disposition": "core",
      "graph_refs": [
       "graph:data/grixis/graph/wick-the-whorled-mind.json#metrics/Arcane Adaptation",
       "graph:data/grixis/graph/wick-the-whorled-mind.json#combo:803-2034-5853",
       "graph:data/grixis/graph/wick-the-whorled-mind.json#combo:803-2292-5853"
      ],
      "roles": [],
      "structural_necessity": "necessary"
     },
     {
      "blueprint_refs": [],
      "card": "Arcane Signet",
      "decision_support": false,
      "disposition": "functional_retain",
      "graph_refs": [
       "graph:data/grixis/graph/wick-the-whorled-mind.json#metrics/Arcane Signet"
      ],
      "roles": [
       "ramp"
      ],
      "structural_necessity": "redundant"
     },
     {
      "blueprint_refs": [
       "blueprint:data/grixis/blueprints/wick-the-whorled-mind.json#packages/pkg:outlets",
       "blueprint:data/grixis/blueprints/wick-the-whorled-mind.json#win_conditions/snail-rat-loop"
      ],
      "card": "Ashnod's Altar",
      "decision_support": true,
      "disposition": "strong_retain",
      "graph_refs": [
       "graph:data/grixis/graph/wick-the-whorled-mind.json#metrics/Ashnod's Altar",
       "graph:data/grixis/graph/wick-the-whorled-mind.json#combo:2034-5853-5929",
       "graph:data/grixis/graph/wick-the-whorled-mind.json#combo:803-2034-5853"
      ],
      "roles": [
       "ramp"
      ],
      "structural_necessity": "important"
     },
     {
      "blueprint_refs": [],
      "card": "Black Market Connections",
      "decision_support": false,
      "disposition": "flexible",
      "graph_refs": [
       "graph:data/grixis/graph/wick-the-whorled-mind.json#metrics/Black Market Connections"
      ],
      "roles": [
       "draw",
       "ramp"
      ],
      "structural_necessity": "redundant"
     },
     {
      "blueprint_refs": [
       "blueprint:data/grixis/blueprints/wick-the-whorled-mind.json#packages/pkg:snail-growth",
       "blueprint:data/grixis/blueprints/wick-the-whorled-mind.json#plan/value",
       "blueprint:data/grixis/blueprints/wick-the-whorled-mind.json#win_conditions/big-snail"
      ],
      "card": "Blade of the Bloodchief",
      "decision_support": true,
      "disposition": "core",
      "graph_refs": [
       "graph:data/grixis/graph/wick-the-whorled-mind.json#metrics/Blade of the Bloodchief",
       "graph:data/grixis/graph/wick-the-whorled-mind.json#package:snail-growth"
      ],
      "roles": [],
      "structural_necessity": "necessary"
     },
     {
      "blueprint_refs": [],
      "card": "Blightstep Pathway // Searstep Pathway",
      "decision_support": false,
      "disposition": "functional_retain",
      "graph_refs": [
       "graph:data/grixis/graph/wick-the-whorled-mind.json#metrics/Blightstep Pathway // Searstep Pathway"
      ],
      "roles": [
       "land",
       "ramp"
      ],
      "structural_necessity": "redundant"
     },
     {
      "blueprint_refs": [],
      "card": "Boggart Trawler // Boggart Bog",
      "decision_support": false,
      "disposition": "meta_dependent",
      "graph_refs": [
       "graph:data/grixis/graph/wick-the-whorled-mind.json#metrics/Boggart Trawler // Boggart Bog"
      ],
      "roles": [
       "land",
       "ramp"
      ],
      "structural_necessity": "redundant"
     },
     {
      "blueprint_refs": [
       "blueprint:data/grixis/blueprints/wick-the-whorled-mind.json#identity_core/Bulk Up",
       "blueprint:data/grixis/blueprints/wick-the-whorled-mind.json#packages/pkg:snail-growth",
       "blueprint:data/grixis/blueprints/wick-the-whorled-mind.json#plan/value"
      ],
      "card": "Bulk Up",
      "decision_support": true,
      "disposition": "core",
      "graph_refs": [
       "graph:data/grixis/graph/wick-the-whorled-mind.json#metrics/Bulk Up",
       "graph:data/grixis/graph/wick-the-whorled-mind.json#package:snail-growth"
      ],
      "roles": [],
      "structural_necessity": "necessary"
     },
     {
      "blueprint_refs": [
       "blueprint:data/grixis/blueprints/wick-the-whorled-mind.json#packages/pkg:outlets",
       "blueprint:data/grixis/blueprints/wick-the-whorled-mind.json#win_conditions/snail-rat-loop"
      ],
      "card": "Carrion Feeder",
      "decision_support": true,
      "disposition": "strong_retain",
      "graph_refs": [
       "graph:data/grixis/graph/wick-the-whorled-mind.json#metrics/Carrion Feeder",
       "graph:data/grixis/graph/wick-the-whorled-mind.json#combo:2438-5853-5929",
       "graph:data/grixis/graph/wick-the-whorled-mind.json#combo:803-2438-5853"
      ],
      "roles": [],
      "structural_necessity": "important"
     },
     {
      "blueprint_refs": [],
      "card": "Chittering Witch",
      "decision_support": false,
      "disposition": "weak_retain",
      "graph_refs": [
       "graph:data/grixis/graph/wick-the-whorled-mind.json#metrics/Chittering Witch"
      ],
      "roles": [],
      "structural_necessity": "independent"
     },
     {
      "blueprint_refs": [],
      "card": "Clearwater Pathway // Murkwater Pathway",
      "decision_support": false,
      "disposition": "functional_retain",
      "graph_refs": [
       "graph:data/grixis/graph/wick-the-whorled-mind.json#metrics/Clearwater Pathway // Murkwater Pathway"
      ],
      "roles": [
       "land",
       "ramp"
      ],
      "structural_necessity": "redundant"
     },
     {
      "blueprint_refs": [],
      "card": "Dark Ritual",
      "decision_support": false,
      "disposition": "flexible",
      "graph_refs": [
       "graph:data/grixis/graph/wick-the-whorled-mind.json#metrics/Dark Ritual"
      ],
      "roles": [
       "ramp"
      ],
      "structural_necessity": "redundant"
     },
     {
      "blueprint_refs": [
       "blueprint:data/grixis/blueprints/wick-the-whorled-mind.json#tutor_targets/Arcane Adaptation",
       "blueprint:data/grixis/blueprints/wick-the-whorled-mind.json#win_conditions/snail-rat-loop"
      ],
      "card": "Demonic Tutor",
      "decision_support": true,
      "disposition": "strong_retain",
      "graph_refs": [
       "graph:data/grixis/graph/wick-the-whorled-mind.json#metrics/Demonic Tutor"
      ],
      "roles": [
       "tutor"
      ],
      "structural_necessity": "important"
     },
     {
      "blueprint_refs": [
       "blueprint:data/grixis/blueprints/wick-the-whorled-mind.json#tutor_targets/Arcane Adaptation",
       "blueprint:data/grixis/blueprints/wick-the-whorled-mind.json#win_conditions/snail-rat-loop"
      ],
      "card": "Diabolic Intent",
      "decision_support": true,
      "disposition": "strong_retain",
      "graph_refs": [
       "graph:data/grixis/graph/wick-the-whorled-mind.json#metrics/Diabolic Intent"
      ],
      "roles": [
       "tutor"
      ],
      "structural_necessity": "important"
     },
     {
      "blueprint_refs": [],
      "card": "Fellwar Stone",
      "decision_support": false,
      "disposition": "flexible",
      "graph_refs": [
       "graph:data/grixis/graph/wick-the-whorled-mind.json#metrics/Fellwar Stone"
      ],
      "roles": [
       "ramp"
      ],
      "structural_necessity": "redundant"
     },
     {
      "blueprint_refs": [